cluster,label_llm,produto,urgencia,causa_raiz_llm,acao_recomendada,top_cdu_names,volume_procedentes,pct_do_indice
5,Reclamações Bacen Mercado Pago,Conta,Alta,"As reclamações foram julgadas procedentes devido à falta de gestão adequada dos casos e problemas técnicos recorrentes, como bugs e dificuldades de acesso. Além disso, questões relacionadas à LGPD e cancelamento de contas também contribuíram para a insatisfação dos usuários.","Implementar melhorias na gestão de casos e na plataforma para reduzir bugs e facilitar o acesso dos usuários. Além disso, reforçar a comunicação sobre o status de cancelamentos e garantir conformidade com a LGPD.","Gestão de casos, Bugs, Usuário deseja cancelar a conta",81,22.7
0,Fraudes em pagamentos MP,Conta,Alta,"O Bacen julga procedente devido ao alto número de reclamações relacionadas a fraudes em pagamentos e transferências, evidenciando a vulnerabilidade dos usuários. A falta de segurança nas transações e o desconhecimento das mesmas contribuem para a decisão.","Implementar medidas de segurança adicionais, como autenticação em duas etapas e monitoramento em tempo real das transações. Além disso, promover campanhas de conscientização para educar os usuários sobre como identificar e evitar fraudes.","Fraude com pagamentos ou transferência contas MP, Fraude transferência de outro banco para MP, Desconhecimento de transações",68,19.0
1,Problemas com pagamentos,Cartão de Crédito,Alta,O Bacen julga procedente devido à alta incidência de reclamações relacionadas a pagamentos não reconhecidos e dificuldades na visualização de transações. Isso indica falhas na comunicação e no sistema de gestão de pagamentos da empresa.,"Reforçar a comunicação com os clientes sobre o status das transações e implementar melhorias no sistema de identificação de pagamentos. Além disso, oferecer suporte proativo para resolver questões de pagamentos não reconhecidos.","Eu não fiz esse pagamento, Quero meu dinheiro de volta, Não consegui pagar",59,16.5
6,Reclamações de Créditos,Consumer Credits,Alta,"O Bacen julga procedente devido a falhas na gestão de créditos e atrasos nos pagamentos, que impactam diretamente a experiência do consumidor. Além disso, problemas técnicos e bugs contribuem para a insatisfação dos usuários.","Implementar melhorias na plataforma para evitar bugs e atrasos nos pagamentos. Além disso, reforçar a comunicação com os clientes sobre a gestão de casos e regulamentos relacionados aos créditos.","Gerais, Consultas por atraso de pagamento, Bugs",43,12.0
2,Reclamações Cartão de Crédito,Cartão de Crédito,Alta,"O Bacen julgou procedente devido à alta incidência de reclamações relacionadas a funcionalidades de cartões de crédito, especialmente em consultas por resumos e problemas funcionais. Isso indica falhas na comunicação e na operação do produto, afetando a experiência do usuário.","Implementar melhorias na interface de consulta de resumos e reforçar a equipe de suporte para resolver problemas funcionais rapidamente. Além disso, realizar treinamentos regulares para a equipe de atendimento sobre as funcionalidades do cartão.","Consultas por Resumen, Funcionales, Gestão de casos",39,10.9
3,Reclamações Procedentes Bacen,Conta,Alta,"O Bacen julga procedente devido a inconsistências nas restrições aplicadas aos usuários, que muitas vezes não são justificadas ou não foram comunicadas adequadamente. Além disso, a falta de gestão eficaz dos casos contribui para a insatisfação dos clientes.","Implementar um sistema de comunicação mais transparente sobre restrições e suas justificativas. Além disso, fortalecer a gestão de casos para garantir que as reclamações sejam tratadas de forma rápida e eficiente.","Outras restrições, Sem restrição, Gestão de casos",37,10.4
4,Fraude PIX,Pix,Alta,"O Bacen julga procedente devido à evidência de que as transações foram realizadas sem o consentimento do titular da conta, caracterizando fraude. A falta de mecanismos eficazes de segurança para prevenir tais incidentes contribui para a decisão.","Reforçar a autenticação em duas etapas para transações PIX e implementar alertas em tempo real para atividades suspeitas. Além disso, promover campanhas de conscientização sobre segurança digital para os usuários.",Fraude PIX,30,8.4
